parent,parent_label,winner_notation,winner_label,winner_sources,winner_children,losers,n_losers,norm_key
068816,OFFENSES AGAINST PUBLIC ADMINISTRATION,068823,BRIBERY AND CORRUPTION,0,12,068854=CORRUPTION AND BRIBERY,1,BRIBERY CORRUPTION
068816,OFFENSES AGAINST PUBLIC ADMINISTRATION,068861,FALSE STATEMENTS AND PERJURY,0,2,068890=PERJURY AND FALSE STATEMENTS,1,FALSE PERJURY STATEMENT
068823,BRIBERY AND CORRUPTION,068824,BRIBE RECEIVING,0,2,068839=RECEIVING A BRIBE;068841=RECEIVING BRIBES,2,BRIBE RECEIVING
069334,OFFENSES AGAINST PUBLIC ORDER,069347,RIOT AND UNLAWFUL ASSEMBLY,0,1,069351=UNLAWFUL ASSEMBLY AND RIOT,1,ASSEMBLY RIOT UNLAWFUL
069441,OFFENSES AGAINST PUBLIC ORDER AND MORALS,069453,GAMBLING AND LOTTERY OFFENSES,0,1,069466=LOTTERY AND GAMBLING OFFENSES,1,GAMBLING LOTTERY OFFENSE
069632,OFFENSES AGAINST THE ADMINISTRATION OF JUSTICE,069694,PERJURY AND FALSE OATH,0,1,069697=PERJURY AND FALSE OATHS,1,FALSE OATH PERJURY
069671,OFFENSES BY JUDICIAL AND QUASI-JUDICIAL OFFICERS,069673,OFFENSES OF REFEREES IN BANKRUPTCY,2,0,069672=OFFENSES BY REFEREES IN BANKRUPTCY,1,BANKRUPTCY OFFENSE REFEREE
069818,HOMICIDE,069878,STATUTORY FRAMEWORKS,1,3,069874=STATUTORY FRAMEWORK,1,FRAMEWORK STATUTORY
069840,MANSLAUGHTER,069843,FIRST-DEGREE MANSLAUGHTER,1,0,069844=MANSLAUGHTER IN THE FIRST DEGREE,1,DEGREE FIRST MANSLAUGHTER
069874,STATUTORY FRAMEWORK,069875,CALIFORNIA PENAL CODE SECTIONS 187-199,2,0,069876=CALIFORNIA PENAL CODE SECTIONS 187–199,1,187 199 CALIFORNIA CODE PENAL SECTION
070239,PRINCIPALS,070243,PRINCIPAL IN THE SECOND DEGREE,1,0,070244=PRINCIPALS IN THE SECOND DEGREE,1,DEGREE PRINCIPAL SECOND
070288,CRIMINAL FACILITATION,070290,FIRST DEGREE CRIMINAL FACILITATION,1,0,070291=FIRST-DEGREE CRIMINAL FACILITATION,1,CRIMINAL DEGREE FACILITATION FIRST
070625,PROPERTY AND ECONOMIC OFFENSES,070633,FRAUD AND FALSE PRETENSES,0,2,070638=FRAUD BY FALSE PRETENSES,1,FALSE FRAUD PRETENSE
070650,PROPERTY CRIMES,070688,THEFT/LARCENY,1,0,070679=THEFT AND LARCENY,1,LARCENY THEFT
070689,PROPERTY OFFENSES,070728,LARCENY AND THEFT,0,7,070755=THEFT AND LARCENY,1,LARCENY THEFT
070689,PROPERTY OFFENSES,070762,THEFT AND RELATED OFFENSES,0,2,070765=THEFT-RELATED OFFENSES,1,OFFENSE RELATED THEFT
071003,PUBLIC ORDER OFFENSES,071031,COMMON LAW OFFENSES,0,1,071034=COMMON-LAW OFFENSES,1,COMMON LAW OFFENSE
071003,PUBLIC ORDER OFFENSES,071055,DISTURBANCE OF THE PEACE,0,2,071060=DISTURBANCES OF THE PEACE,1,DISTURBANCE PEACE
071003,PUBLIC ORDER OFFENSES,071084,GAMBLING AND GAMING OFFENSES,0,3,071106=GAMING AND GAMBLING OFFENSES,1,GAMBLING GAMING OFFENSE
071003,PUBLIC ORDER OFFENSES,071143,OBSCENITY AND INDECENCY,0,2,071117=INDECENCY AND OBSCENITY,1,INDECENCY OBSCENITY
071003,PUBLIC ORDER OFFENSES,071200,UNLAWFUL ASSEMBLY AND RIOT,0,3,071174=RIOT AND UNLAWFUL ASSEMBLY,1,ASSEMBLY RIOT UNLAWFUL
071003,PUBLIC ORDER OFFENSES,071179,"RIOT, ROUT, AND UNLAWFUL ASSEMBLY",1,0,"071207=UNLAWFUL ASSEMBLY, ROUT, AND RIOT",1,ASSEMBLY RIOT ROUT UNLAWFUL
071248,PUNISHMENT,071277,THEORIES AND JUSTIFICATIONS OF PUNISHMENT,1,2,071275=THEORIES AND JUSTIFICATION OF PUNISHMENT,1,JUSTIFICATION PUNISHMENT THEORIE
071309,PUNISHMENT AND SENTENCING,071380,EXECUTIVE CLEMENCY AND PARDON,0,3,071385=EXECUTIVE CLEMENCY AND PARDONS,1,CLEMENCY EXECUTIVE PARDON
071309,PUNISHMENT AND SENTENCING,071456,SENTENCING ENHANCEMENT,0,1,071458=SENTENCING ENHANCEMENTS,1,ENHANCEMENT SENTENCING
071310,CAPITAL PUNISHMENT,071313,CLEMENCY AND EXECUTIVE COMMUTATION,1,0,071342=EXECUTIVE CLEMENCY AND COMMUTATION,1,CLEMENCY COMMUTATION EXECUTIVE
071310,CAPITAL PUNISHMENT,071347,METHODS OF EXECUTION,0,2,071345=METHOD OF EXECUTION,1,EXECUTION METHOD
071373,EXECUTIVE CLEMENCY,071377,PARDONS,0,2,071374=PARDON,1,PARDON
071631,SENTENCING AND PUNISHMENT,071710,SENTENCING PROCEDURE AND STANDARDS,0,1,071713=SENTENCING PROCEDURES AND STANDARDS,1,PROCEDURE SENTENCING STANDARD
071725,SEX OFFENSES,071770,RAPE AND SEXUAL ASSAULT,0,6,071789=SEXUAL ASSAULT AND RAPE,1,ASSAULT RAPE SEXUAL
071751,RAPE,071756,ELEMENTS AND DEFINITION OF THE OFFENSE,1,0,071757=OFFENSE ELEMENTS AND DEFINITION,1,DEFINITION ELEMENT OFFENSE
071836,SEXUAL OFFENSES,071856,RAPE AND SEXUAL ASSAULT,0,4,071867=SEXUAL ASSAULT AND RAPE,1,ASSAULT RAPE SEXUAL
071923,SPECIFIC CRIMES,071926,OFFENSES AGAINST PUBLIC ADMINISTRATION AND JUSTICE,0,1,071931=OFFENSES AGAINST PUBLIC JUSTICE AND ADMINISTRATION,1,ADMINISTRATION AGAINST JUSTICE OFFENSE PUBLIC
072113,OFFENSES AGAINST PUBLIC MORALS AND ORDER,072116,GAMING AND GAMBLING OFFENSES,0,2,072114=GAMBLING AND GAMING OFFENSES,1,GAMBLING GAMING OFFENSE
072151,STATUTORY CRIMES,072211,STATUTORY ENLARGEMENTS OF COMMON-LAW OFFENSES,1,1,"072152=COMMON-LAW OFFENSES, STATUTORY ENLARGEMENTS",1,COMMON ENLARGEMENT LAW OFFENSE STATUTORY
072151,STATUTORY CRIMES,072186,OFFENSES AGAINST PERSONS,0,1,072189=OFFENSES AGAINST THE PERSON,1,AGAINST OFFENSE PERSON
072283,STATUTORY OFFENSES,072306,OFFENSES AGAINST PERSONS,0,1,072315=OFFENSES AGAINST THE PERSON,1,AGAINST OFFENSE PERSON
072677,PROPERTY OFFENSES,072680,LARCENY AND THEFT,0,3,072691=THEFT AND LARCENY,1,LARCENY THEFT
072740,SUBSTANTIVE CRIMINAL LAW,072893,ELEMENTS OF CRIMINAL OFFENSES,0,6,072835=ELEMENTS OF A CRIMINAL OFFENSE,1,CRIMINAL ELEMENT OFFENSE
072740,SUBSTANTIVE CRIMINAL LAW,072838,ELEMENTS OF AN OFFENSE,0,2,072907=ELEMENTS OF OFFENSES;073146=OFFENSE ELEMENTS,2,ELEMENT OFFENSE
072740,SUBSTANTIVE CRIMINAL LAW,072850,ELEMENTS OF CRIMES,0,11,072845=ELEMENTS OF CRIME,1,CRIME ELEMENT
072740,SUBSTANTIVE CRIMINAL LAW,073138,MENTAL STATES (MENS REA),0,1,073127=MENS REA AND MENTAL STATE,1,MEN MENTAL REA STATE
072740,SUBSTANTIVE CRIMINAL LAW,073290,OFFENSES AGAINST THE PERSON,1,21,073179=OFFENSES AGAINST PERSONS,1,AGAINST OFFENSE PERSON
072740,SUBSTANTIVE CRIMINAL LAW,073405,PARTIES TO CRIME,0,7,073422=PARTIES TO CRIMES,1,CRIME PARTIE
072740,SUBSTANTIVE CRIMINAL LAW,073584,STATUTORY INTERPRETATION AND CONSTRUCTION,0,2,073539=STATUTORY CONSTRUCTION AND INTERPRETATION,1,CONSTRUCTION INTERPRETATION STATUTORY
072850,ELEMENTS OF CRIMES,072869,MENTAL STATES AND INTENT,1,1,072867=MENTAL STATE AND INTENT,1,INTENT MENTAL STATE
072913,GENERAL PRINCIPLES OF CRIMINAL LIABILITY,072940,MENTAL STATE AND CULPABILITY,0,2,072943=MENTAL STATES AND CULPABILITY,1,CULPABILITY MENTAL STATE
073319,HOMICIDE,073323,CLASSIFICATION OF HOMICIDE,1,1,073325=CLASSIFICATIONS OF HOMICIDE,1,CLASSIFICATION HOMICIDE
073447,PROPERTY AND ECONOMIC OFFENSES,073448,CHEATING AND FRAUD OFFENSES,0,1,073450=FRAUD AND CHEATING OFFENSES,1,CHEATING FRAUD OFFENSE
073506,SEXUAL OFFENSES,073507,ADULTERY AND FORNICATION,0,1,073513=FORNICATION AND ADULTERY,1,ADULTERY FORNICATION
073708,SUBSTANTIVE CRIMINAL LIABILITY,073713,ELEMENTS OF AN OFFENSE,0,3,073726=ELEMENTS OF OFFENSES,1,ELEMENT OFFENSE
073708,SUBSTANTIVE CRIMINAL LIABILITY,073748,MENS REA AND MENTAL STATE,0,1,073751=MENS REA AND MENTAL STATES,1,MEN MENTAL REA STATE
073762,SUBSTANTIVE CRIMINAL OFFENSES,073870,OFFENSES AGAINST FAMILY AND MORAL ORDER,0,2,074121=OFFENSES AGAINST THE FAMILY AND MORAL ORDER,1,AGAINST FAMILY MORAL OFFENSE ORDER
073762,SUBSTANTIVE CRIMINAL OFFENSES,074126,OFFENSES AGAINST THE PERSON,0,11,073879=OFFENSES AGAINST PERSONS,1,AGAINST OFFENSE PERSON
073762,SUBSTANTIVE CRIMINAL OFFENSES,073993,OFFENSES AGAINST PROPERTY AND PERSON,0,1,073882=OFFENSES AGAINST PERSONS AND PROPERTY,1,AGAINST OFFENSE PERSON PROPERTY
073762,SUBSTANTIVE CRIMINAL OFFENSES,073975,OFFENSES AGAINST PROPERTY AND DWELLING,0,1,073978=OFFENSES AGAINST PROPERTY AND DWELLINGS,1,AGAINST DWELLING OFFENSE PROPERTY
073762,SUBSTANTIVE CRIMINAL OFFENSES,074021,OFFENSES AGAINST PUBLIC ADMINISTRATION OR GOVERNMENTAL AUTHORITY,0,1,074008=OFFENSES AGAINST PUBLIC ADMINISTRATION AND GOVERNMENTAL AUTHORITY,1,ADMINISTRATION AGAINST AUTHORITY GOVERNMENTAL OFFENSE PUBLIC
073762,SUBSTANTIVE CRIMINAL OFFENSES,074011,OFFENSES AGAINST PUBLIC ADMINISTRATION AND JUSTICE,0,4,074035=OFFENSES AGAINST PUBLIC JUSTICE AND ADMINISTRATION,1,ADMINISTRATION AGAINST JUSTICE OFFENSE PUBLIC
073762,SUBSTANTIVE CRIMINAL OFFENSES,074097,OFFENSES AGAINST PUBLIC ORDER AND SAFETY,0,3,074105=OFFENSES AGAINST PUBLIC SAFETY AND ORDER,1,AGAINST OFFENSE ORDER PUBLIC SAFETY
073884,OFFENSES AGAINST PROPERTY,073927,LARCENY AND THEFT,0,2,073948=THEFT AND LARCENY,1,LARCENY THEFT
074192,PROPERTY OFFENSES,074206,LARCENY AND THEFT,0,2,074211=THEFT (LARCENY);074214=THEFT AND LARCENY,2,LARCENY THEFT
074367,SUBSTANTIVE OFFENSES,074371,DRUG AND CONTROLLED-SUBSTANCE OFFENSES,1,0,074368=DRUG AND CONTROLLED SUBSTANCE OFFENSES,1,CONTROLLED DRUG OFFENSE SUBSTANCE
074367,SUBSTANTIVE OFFENSES,074457,OFFENSES AGAINST PUBLIC MORALS AND ORDER,0,1,074460=OFFENSES AGAINST PUBLIC ORDER AND MORALS,1,AGAINST MORAL OFFENSE ORDER PUBLIC
074644,,080819,JURISDICTION AND CHOICE OF LAW,0,3,074781=CHOICE OF LAW AND JURISDICTION,1,CHOICE JURISDICTION LAW
074644,,074801,CHOICE OF LAW IN TORT,0,2,074806=CHOICE OF LAW IN TORTS,1,CHOICE LAW TORT
074644,,079333,CONFLICT OF LAWS (CHOICE OF LAW),0,4,"079351=CONFLICT OF LAWS - CHOICE OF LAW;079360=CONFLICT OF LAWS / CHOICE OF LAW;079382=CONFLICT OF LAWS, CHOICE OF LAW",3,CHOICE CONFLICT LAW LAW
074644,,080873,JURISDICTION IN CONFLICT OF LAWS,0,3,079366=CONFLICT OF LAWS AND JURISDICTION;080833=JURISDICTION AND CONFLICT OF LAWS,2,CONFLICT JURISDICTION LAW
074644,,079370,CONFLICT OF LAWS DOCTRINE,0,1,079379=CONFLICT OF LAWS DOCTRINES,1,CONFLICT DOCTRINE LAW
074644,,081124,TREATIES AND INTERNATIONAL AGREEMENTS,0,15,079570=INTERNATIONAL AGREEMENTS AND TREATIES;080723=INTERNATIONAL TREATIES AND AGREEMENTS,2,AGREEMENT INTERNATIONAL TREATIE
074644,,080605,INTERNATIONAL LAW OF WAR AND ARMED CONFLICT,0,1,079605=INTERNATIONAL ARMED CONFLICT AND THE LAWS OF WAR,1,ARMED CONFLICT INTERNATIONAL LAW WAR
074644,,079612,INTERNATIONAL COURTS AND TRIBUNALS,0,3,080763=INTERNATIONAL TRIBUNALS AND COURTS,1,COURT INTERNATIONAL TRIBUNAL
074644,,079744,INTERNATIONAL HUMAN RIGHTS LAW,0,44,080530=INTERNATIONAL LAW AND HUMAN RIGHTS,1,HUMAN INTERNATIONAL LAW RIGHT
074644,,080093,INTERNATIONAL HUMANITARIAN LAW AND LAW OF ARMED CONFLICT,0,5,080065=INTERNATIONAL HUMANITARIAN LAW (LAW OF ARMED CONFLICT);080111=INTERNATIONAL HUMANITARIAN LAW AND LAWS OF ARMED CONFLICT,2,ARMED CONFLICT HUMANITARIAN INTERNATIONAL LAW LAW
074644,,080115,INTERNATIONAL HUMANITARIAN LAW AND LAWS OF WAR,0,16,080069=INTERNATIONAL HUMANITARIAN LAW (LAWS OF WAR);080081=INTERNATIONAL HUMANITARIAN LAW / LAWS OF WAR,2,HUMANITARIAN INTERNATIONAL LAW LAW WAR
074644,,080575,INTERNATIONAL LAW DOCTRINES AND SOURCES,0,1,081043=SOURCES AND DOCTRINES OF INTERNATIONAL LAW,1,DOCTRINE INTERNATIONAL LAW SOURCE
074644,,080844,JURISDICTION AND JUDGMENT RECOGNITION,0,2,080862=JURISDICTION AND RECOGNITION OF JUDGMENTS,1,JUDGMENT JURISDICTION RECOGNITION
074649,CHOICE OF LAW,074650,CONTRACT OBLIGATIONS,0,1,074674=CONTRACTS AND OBLIGATIONS,1,CONTRACT OBLIGATION
074705,REAL PROPERTY,074711,VALIDITY OF CONVEYANCES,0,2,074709=VALIDITY OF CONVEYANCE,1,CONVEYANCE VALIDITY
075006,CONFLICT OF LAWS,075025,BANKRUPTCY AND INSOLVENCY,1,0,077101=INSOLVENCY AND BANKRUPTCY,1,BANKRUPTCY INSOLVENCY
075006,CONFLICT OF LAWS,076168,CORPORATIONS AND BUSINESS ASSOCIATIONS,0,4,075064=BUSINESS ASSOCIATIONS AND CORPORATIONS,1,ASSOCIATION BUSINESS CORPORATION
075006,CONFLICT OF LAWS,075719,CHOICE OF LAW DOCTRINE,0,2,075724=CHOICE OF LAW DOCTRINES,1,CHOICE DOCTRINE LAW
075006,CONFLICT OF LAWS,075731,CHOICE OF LAW FOR CONTRACTS,1,2,075777=CHOICE OF LAW IN CONTRACT;075785=CHOICE OF LAW IN CONTRACTS,2,CHOICE CONTRACT LAW
075006,CONFLICT OF LAWS,075794,CHOICE OF LAW IN CONTRACTUAL MATTERS,0,1,075738=CHOICE OF LAW FOR CONTRACTUAL MATTERS,1,CHOICE CONTRACTUAL LAW MATTER
075006,CONFLICT OF LAWS,075749,CHOICE OF LAW FOR PROPERTY,0,4,075799=CHOICE OF LAW IN PROPERTY;078487=PROPERTY AND CHOICE OF LAW;078697=PROPERTY CHOICE OF LAW,3,CHOICE LAW PROPERTY
075006,CONFLICT OF LAWS,075773,CHOICE OF LAW FOR TORTS,1,1,075816=CHOICE OF LAW IN TORT;079156=TORT CHOICE OF LAW,2,CHOICE LAW TORT
075006,CONFLICT OF LAWS,077934,OBLIGATIONS AND CONTRACTS,0,5,076107=CONTRACTS AND OBLIGATIONS,1,CONTRACT OBLIGATION
075006,CONFLICT OF LAWS,078824,REMEDIES AND DAMAGES,0,3,076217=DAMAGES AND REMEDIES,1,DAMAGE REMEDIE
075006,CONFLICT OF LAWS,076281,DEFINITIONS AND GENERAL CONCEPTS,0,1,077019=GENERAL CONCEPTS AND DEFINITIONS,1,CONCEPT DEFINITION GENERAL
075006,CONFLICT OF LAWS,078840,SCOPE AND DEFINITION,0,5,076283=DEFINITIONS AND SCOPE,1,DEFINITION SCOPE
075006,CONFLICT OF LAWS,079125,THEORETICAL AND DOCTRINAL FOUNDATIONS,2,1,076292=DOCTRINAL AND THEORETICAL FOUNDATIONS,1,DOCTRINAL FOUNDATION THEORETICAL
075006,CONFLICT OF LAWS,076320,DOCTRINE AND THEORY,0,2,079140=THEORY AND DOCTRINE,1,DOCTRINE THEORY
075006,CONFLICT OF LAWS,076866,FAMILY STATUS AND DOMESTIC RELATIONS,0,2,076340=DOMESTIC RELATIONS AND FAMILY STATUS,1,DOMESTIC FAMILY RELATION STATU
075006,CONFLICT OF LAWS,078879,STATUS AND DOMESTIC RELATIONS,0,2,076345=DOMESTIC RELATIONS AND STATUS,1,DOMESTIC RELATION STATU
075006,CONFLICT OF LAWS,077990,PERSONAL STATUS AND DOMICIL,0,2,076448=DOMICIL AND PERSONAL STATUS,1,DOMICIL PERSONAL STATU
075006,CONFLICT OF LAWS,079278,TRUSTS AND EQUITABLE INTERESTS,0,2,076625=EQUITABLE INTERESTS AND TRUSTS,1,EQUITABLE INTEREST TRUST
075006,CONFLICT OF LAWS,076980,FOREIGN LAW IN DOMESTIC COURTS,0,4,077005=FOREIGN LAWS IN DOMESTIC COURTS,1,COURT DOMESTIC FOREIGN LAW
075006,CONFLICT OF LAWS,077086,HISTORY OF CONFLICT OF LAWS,0,4,077094=HISTORY OF THE CONFLICT OF LAWS,1,CONFLICT HISTORY LAW
075006,CONFLICT OF LAWS,078965,SUCCESSION AND INHERITANCE,0,4,077098=INHERITANCE AND SUCCESSION,1,INHERITANCE SUCCESSION
075006,CONFLICT OF LAWS,077239,JUDGMENTS AND JURISDICTION,0,1,077687=JURISDICTION AND JUDGMENTS,1,JUDGMENT JURISDICTION
075006,CONFLICT OF LAWS,077602,JURISDICTION AND CHOICE OF LAW,0,16,077703=JURISDICTION IN CHOICE OF LAW,1,CHOICE JURISDICTION LAW
075006,CONFLICT OF LAWS,077659,JURISDICTION AND CHOICE OF LAW CONNECTORS,0,1,077669=JURISDICTION AND CHOICE-OF-LAW CONNECTORS,1,CHOICE CONNECTOR JURISDICTION LAW
075006,CONFLICT OF LAWS,077681,JURISDICTION AND JUDGMENT RECOGNITION,0,2,077699=JURISDICTION AND RECOGNITION OF JUDGMENTS,1,JUDGMENT JURISDICTION RECOGNITION
075006,CONFLICT OF LAWS,077973,PERSONAL LAW AND STATUS,0,1,078898=STATUS AND PERSONAL LAW,1,LAW PERSONAL STATU
075006,CONFLICT OF LAWS,078000,PERSONAL STATUS AND FAMILY RELATIONS,0,5,"078912=STATUS, FAMILY, AND PERSONAL RELATIONS",1,FAMILY PERSONAL RELATION STATU
075006,CONFLICT OF LAWS,078702,PROPERTY CONFLICTS,0,3,078465=PROPERTY (CONFLICTS),1,CONFLICT PROPERTY
075006,CONFLICT OF LAWS,078546,PROPERTY AND RIGHTS IN REM,0,2,078741=PROPERTY RIGHTS IN REM,1,PROPERTY REM RIGHT
075006,CONFLICT OF LAWS,078757,"PROPERTY, TRUSTS, AND SUCCESSIONS",0,2,"078751=PROPERTY, SUCCESSION, AND TRUSTS",1,PROPERTY SUCCESSION TRUST
075006,CONFLICT OF LAWS,078956,SUCCESSION AND ESTATES,0,3,079083=SUCCESSIONS AND ESTATES,1,ESTATE SUCCESSION
075006,CONFLICT OF LAWS,078991,SUCCESSION AND WILLS,0,7,079290=WILLS AND SUCCESSION,1,SUCCESSION WILL
075006,CONFLICT OF LAWS,079248,TORTS,0,4,079144=TORT,1,TORT
075104,CHOICE OF LAW,075115,APPLICABLE LAW FOR NEGOTIABLE INSTRUMENTS,5,0,075350=LAW APPLICABLE TO NEGOTIABLE INSTRUMENTS,1,APPLICABLE INSTRUMENT LAW NEGOTIABLE
075104,CHOICE OF LAW,075253,CONTRACTS AND OBLIGATIONS,0,1,075402=OBLIGATIONS AND CONTRACTS,1,CONTRACT OBLIGATION
075104,CHOICE OF LAW,075421,PERSONAL RIGHTS AND STATUS,0,1,075592=STATUS AND PERSONAL RIGHTS,1,PERSONAL RIGHT STATU
075104,CHOICE OF LAW,075557,REMEDIES AND PROCEDURAL MATTERS,2,0,075444=PROCEDURAL MATTERS AND REMEDIES,1,MATTER PROCEDURAL REMEDIE
075104,CHOICE OF LAW,075485,PROPERTY AND PROPERTY RIGHTS,0,2,075502=PROPERTY AND RIGHTS IN PROPERTY,1,PROPERTY PROPERTY RIGHT
075104,CHOICE OF LAW,075596,STATUTE OF LIMITATIONS,0,1,075599=STATUTES OF LIMITATIONS,1,LIMITATION STATUTE
075104,CHOICE OF LAW,075621,SUCCESSION AND WILLS,0,1,075687=WILLS AND SUCCESSION,1,SUCCESSION WILL
075104,CHOICE OF LAW,075628,"SUCCESSIONS, WILLS, AND ESTATES",0,2,"075702=WILLS, ESTATES, AND SUCCESSION",1,ESTATE SUCCESSION WILL
075104,CHOICE OF LAW,075637,TORT AND DELICT,0,1,075671=TORTS AND DELICTS,1,DELICT TORT
075104,CHOICE OF LAW,075640,TORT AND PERSONAL INJURY,0,1,075674=TORTS AND PERSONAL INJURY,1,INJURY PERSONAL TORT
075338,INTEREST ANALYSIS,075342,NO-INTEREST OR UNPROVIDED-FOR CASES,1,0,075340=NO-INTEREST (UNPROVIDED-FOR) CASES,1,CASE INTEREST NO UNPROVIDED
076037,PLACE OF CONTRACTING,076055,INFORMAL BILATERAL CONTRACT,1,0,076056=INFORMAL BILATERAL CONTRACTS,1,BILATERAL CONTRACT INFORMAL
076128,CORPORATIONS,076143,DISSOLUTION AND WINDING UP,0,2,076163=WINDING UP AND DISSOLUTION,1,DISSOLUTION UP WINDING
076728,MARRIAGE,076746,VALIDITY OF FOREIGN MARRIAGE,0,3,076750=VALIDITY OF FOREIGN MARRIAGES,1,FOREIGN MARRIAGE VALIDITY
076811,CHILD CUSTODY JURISDICTION,076813,DOMICILE OF CHILD AS JURISDICTIONAL BASIS,0,1,076815=DOMICILE OF THE CHILD AS JURISDICTIONAL BASIS,1,AS BASI CHILD DOMICILE JURISDICTIONAL
076898,FOREIGN CORPORATIONS,076904,DOING BUSINESS QUALIFICATION,0,3,076899=DOING BUSINESS AND QUALIFICATION,1,BUSINESS DOING QUALIFICATION
076952,FOREIGN JUDGMENTS AND AWARDS,076953,ENFORCEMENT AND RECOGNITION OF FOREIGN JUDGMENTS,1,0,076954=RECOGNITION AND ENFORCEMENT OF FOREIGN JUDGMENTS,1,ENFORCEMENT FOREIGN JUDGMENT RECOGNITION
076955,FOREIGN JUDGMENTS AND DECREES,076958,FOREIGN DIVORCE RECOGNITION,0,1,076972=RECOGNITION OF FOREIGN DIVORCE,1,DIVORCE FOREIGN RECOGNITION
077050,HISTORICAL DEVELOPMENT,077054,STATUTIST DOCTRINES,1,0,077051=STATUTIST DOCTRINE,1,DOCTRINE STATUTIST
077132,JUDGMENTS,077133,ENFORCEMENT AND RECOGNITION OF FOREIGN JUDGMENTS,1,0,077142=FOREIGN JUDGMENT RECOGNITION AND ENFORCEMENT;077167=RECOGNITION AND ENFORCEMENT OF FOREIGN JUDGMENTS,2,ENFORCEMENT FOREIGN JUDGMENT RECOGNITION
077184,JUDGMENTS AND DECREES,077210,FOREIGN JUDGMENTS RECOGNITION AND ENFORCEMENT,0,2,077220=RECOGNITION AND ENFORCEMENT OF FOREIGN JUDGMENTS,1,ENFORCEMENT FOREIGN JUDGMENT RECOGNITION
077283,JURISDICTION,077294,DIVORCE JURISDICTION,0,1,077376=JURISDICTION FOR DIVORCE,1,DIVORCE JURISDICTION
078121,PROPERTY,078351,PERSONAL PROPERTY AND CHATTELS,0,2,078164=CHATTELS (PERSONAL PROPERTY);078348=PERSONAL PROPERTY (CHATTELS),2,CHATTEL PERSONAL PROPERTY
078225,IMMOVABLE PROPERTY (LAND),078229,CONVEYANCE AND TRANSFER,0,2,078235=CONVEYANCES AND TRANSFERS,1,CONVEYANCE TRANSFER
078378,SECURED TRANSACTIONS AND LIENS,078381,PLEDGE OF CHATTEL,0,1,078383=PLEDGE OF CHATTELS,1,CHATTEL PLEDGE
078458,TRUST OF LAND,078459,VALIDITY GOVERNED BY LAW OF SITUS,2,0,078460=VALIDITY GOVERNED BY SITUS LAW,1,GOVERNED LAW SITU VALIDITY
078772,RECOGNITION AND ENFORCEMENT OF FOREIGN JUDGMENTS,078780,IN PERSONAM JUDGMENTS,1,0,078781=JUDGMENTS IN PERSONAM,1,JUDGMENT PERSONAM
079269,TRUSTS,079270,ADMINISTRATION OF TRUST OF MOVABLES,0,1,079273=ADMINISTRATION OF TRUSTS OF MOVABLES,1,ADMINISTRATION MOVABLE TRUST
079744,INTERNATIONAL HUMAN RIGHTS LAW,079935,UN TREATY BODIES AND INDIVIDUAL COMMUNICATIONS PROCEDURE,0,1,079940=UN TREATY BODIES AND INDIVIDUAL COMMUNICATIONS PROCEDURES,1,BODIE COMMUNICATION INDIVIDUAL PROCEDURE TREATY UN
079816,REGIONAL HUMAN RIGHTS SYSTEMS,079848,INTER-AMERICAN HUMAN RIGHTS SYSTEM,2,1,079857=INTER-AMERICAN SYSTEM FOR HUMAN RIGHTS,1,AMERICAN HUMAN INTER RIGHT SYSTEM
079819,EUROPEAN CONVENTION ON HUMAN RIGHTS,079822,DEROGATION AND STATE EMERGENCY,0,1,079824=DEROGATION AND STATE OF EMERGENCY,1,DEROGATION EMERGENCY STATE
079967,INTERNATIONAL HUMANITARIAN LAW,079968,CLASSIFICATION OF ARMED CONFLICT,0,1,079970=CLASSIFICATION OF ARMED CONFLICTS,1,ARMED CLASSIFICATION CONFLICT
080156,GENEVA CONVENTIONS OF 1949,080157,CONVENTION (I): WOUNDED AND SICK IN ARMED FORCES IN THE FIELD,1,0,080158=CONVENTION I ON WOUNDED AND SICK IN ARMED FORCES IN THE FIELD,1,ARMED CONVENTION FIELD FORCE I SICK WOUNDED
080213,INTERNATIONAL LAW,080331,LAW OF WAR AND ARMED CONFLICT,0,3,080217=ARMED CONFLICT AND LAW OF WAR;080222=ARMED CONFLICT AND THE LAWS OF WAR,2,ARMED CONFLICT LAW WAR
080279,LAW OF ARMED CONFLICT,080284,MARITIME WARFARE AND NEUTRALITY,0,1,080293=NEUTRALITY AND MARITIME WARFARE,1,MARITIME NEUTRALITY WARFARE
081183,,083382,AGENTS AND AGENCY,0,3,081962=AGENCY AND AGENTS,1,AGENCY AGENT
081183,,081980,AGENCY AND FIDUCIARY RELATIONSHIPS,0,83,090581=FIDUCIARY AND AGENCY RELATIONSHIPS;090750=FIDUCIARY RELATIONSHIPS AND AGENCY,2,AGENCY FIDUCIARY RELATIONSHIP
081183,,082706,AGENCY AND PRINCIPAL-AGENT RELATIONSHIPS,0,2,082703=AGENCY AND PRINCIPAL-AGENT RELATIONSHIP,1,AGENCY AGENT PRINCIPAL RELATIONSHIP
081183,,082711,AGENCY AND REPRESENTATION,0,25,096524=REPRESENTATION AND AGENCY,1,AGENCY REPRESENTATION
081183,,082974,AGENCY RELATIONSHIPS,0,87,082809=AGENCY RELATIONSHIP,1,AGENCY RELATIONSHIP
081183,,083412,AGENTS AND PRINCIPALS,0,7,096055=PRINCIPAL AND AGENT;096094=PRINCIPALS AND AGENTS,2,AGENT PRINCIPAL
081183,,083573,BUSINESS ENTITIES AND ASSOCIATIONS,0,4,083541=BUSINESS ASSOCIATIONS AND ENTITIES,1,ASSOCIATION BUSINESS ENTITIE
081183,,083658,CAPACITY AND DISQUALIFICATION,0,6,083691=CAPACITY AND DISQUALIFICATIONS,1,CAPACITY DISQUALIFICATION
081183,,083768,CAPACITY AND LEGAL QUALIFICATIONS,0,2,091547=LEGAL CAPACITY AND QUALIFICATIONS,1,CAPACITY LEGAL QUALIFICATION
081183,,091830,LEGAL STATUS AND CAPACITY,0,13,083773=CAPACITY AND LEGAL STATUS;091552=LEGAL CAPACITY AND STATUS;096630=STATUS AND LEGAL CAPACITY,3,CAPACITY LEGAL STATU
081183,,083791,CAPACITY AND STATUS OF NATURAL PERSONS,0,8,"094809=NATURAL PERSONS, CAPACITY, AND STATUS;096611=STATUS AND CAPACITY OF NATURAL PERSONS",2,CAPACITY NATURAL PERSON STATU
081183,,094719,NATURAL PERSONS AND CAPACITY,0,4,083815=CAPACITY OF NATURAL PERSONS,1,CAPACITY NATURAL PERSON
081183,,083954,DECEDENTS' ESTATES,0,12,083947=DECEDENTS AND ESTATES,1,DECEDENT ESTATE
081183,,084075,DECEDENTS' ESTATES AND PROBATE ADMINISTRATION,0,1,"084251=DECEDENTS' ESTATES, PROBATE, AND ADMINISTRATION",1,ADMINISTRATION DECEDENT ESTATE PROBATE
081183,,084078,DECEDENTS' ESTATES AND SUCCESSION,0,10,"084383=DECEDENTS, ESTATES, AND SUCCESSION",1,DECEDENT ESTATE SUCCESSION
081183,,084273,"DECEDENTS' ESTATES, SUCCESSION, AND INTESTACY",0,3,"084244=DECEDENTS' ESTATES, INTESTACY, AND SUCCESSION",1,DECEDENT ESTATE INTESTACY SUCCESSION
081183,,086431,FAMILY AND DOMESTIC RELATIONSHIPS,0,5,084414=DOMESTIC AND FAMILY RELATIONSHIPS,1,DOMESTIC FAMILY RELATIONSHIP
081183,,086285,FAMILY AND DOMESTIC RELATIONS,0,30,085641=DOMESTIC RELATIONS AND FAMILY,1,DOMESTIC FAMILY RELATION
081183,,088335,FAMILY LAW AND DOMESTIC RELATIONS,0,68,085648=DOMESTIC RELATIONS AND FAMILY LAW;088931=FAMILY RELATIONS AND DOMESTIC LAW,2,DOMESTIC FAMILY LAW RELATION
081183,,085891,DOMESTIC RELATIONS AND FAMILY STATUS,0,19,088938=FAMILY RELATIONS AND DOMESTIC STATUS;089865=FAMILY STATUS AND DOMESTIC RELATIONS,2,DOMESTIC FAMILY RELATION STATU
081183,,085986,DOMESTIC RELATIONS AND MARITAL STATUS,0,13,092169=MARITAL STATUS AND DOMESTIC RELATIONS,1,DOMESTIC MARITAL RELATION STATU
081183,,092575,MARRIAGE AND DOMESTIC RELATIONS,0,99,086024=DOMESTIC RELATIONS AND MARRIAGE,1,DOMESTIC MARRIAGE RELATION
081183,,086080,DOMICILE AND RESIDENCE,0,6,096543=RESIDENCE AND DOMICILE,1,DOMICILE RESIDENCE
081183,,086203,EMPLOYMENT RELATIONSHIPS,0,2,086200=EMPLOYMENT RELATIONSHIP,1,EMPLOYMENT RELATIONSHIP
081183,,086209,ESTATE ADMINISTRATION AND PROBATE,0,1,096111=PROBATE AND ESTATE ADMINISTRATION,1,ADMINISTRATION ESTATE PROBATE
081183,,089952,FIDUCIARIES AND ESTATE REPRESENTATIVES,0,3,086225=ESTATE FIDUCIARIES AND REPRESENTATIVES;090351=FIDUCIARIES AND REPRESENTATIVES OF ESTATES,2,ESTATE FIDUCIARIE REPRESENTATIVE
081183,,086262,"ESTATES, WILLS, AND TRUSTS",0,1,"096848=WILLS, TRUSTS, AND ESTATES",1,ESTATE TRUST WILL
081183,,086465,FAMILY AND MARITAL RELATIONSHIPS,0,1,091917=MARITAL AND FAMILY RELATIONSHIPS,1,FAMILY MARITAL RELATIONSHIP
081183,,089432,FAMILY RELATIONSHIPS AND DOMESTIC LAW,0,3,088825=FAMILY LAW AND DOMESTIC RELATIONSHIPS,1,DOMESTIC FAMILY LAW RELATIONSHIP
081183,,088850,FAMILY LAW RELATIONSHIPS,0,3,088846=FAMILY LAW AND RELATIONSHIPS,1,FAMILY LAW RELATIONSHIP
081183,,088907,"FAMILY LAW, MARRIAGE, AND DOMESTIC RELATIONS",0,2,"094516=MARRIAGE, DOMESTIC RELATIONS, AND FAMILY LAW",1,DOMESTIC FAMILY LAW MARRIAGE RELATION
081183,,089656,FAMILY RELATIONSHIPS AND MARITAL STATUS,0,1,092175=MARITAL STATUS AND FAMILY RELATIONSHIPS,1,FAMILY MARITAL RELATIONSHIP STATU
081183,,093930,MARRIAGE AND FAMILY RELATIONSHIPS,0,20,089661=FAMILY RELATIONSHIPS AND MARRIAGE,1,FAMILY MARRIAGE RELATIONSHIP
081183,,089675,FAMILY RELATIONSHIPS AND STATUS,0,34,089870=FAMILY STATUS AND RELATIONSHIPS,1,FAMILY RELATIONSHIP STATU
081183,,091805,LEGAL REPRESENTATIVES AND FIDUCIARIES,0,3,089971=FIDUCIARIES AND LEGAL REPRESENTATIVES,1,FIDUCIARIE LEGAL REPRESENTATIVE
081183,,090513,"FIDUCIARIES, REPRESENTATIVES, AND OFFICIALS",0,4,089977=FIDUCIARIES AND OFFICIAL REPRESENTATIVES,1,FIDUCIARIE OFFICIAL REPRESENTATIVE
081183,,089984,FIDUCIARIES AND PERSONAL REPRESENTATIVES,0,4,095182=PERSONAL REPRESENTATIVES AND FIDUCIARIES,1,FIDUCIARIE PERSONAL REPRESENTATIVE
081183,,090051,FIDUCIARIES AND REPRESENTATIVES,0,17,096536=REPRESENTATIVES AND FIDUCIARIES,1,FIDUCIARIE REPRESENTATIVE
081183,,096788,TRUSTS AND FIDUCIARY RELATIONSHIPS,0,9,090784=FIDUCIARY RELATIONSHIPS AND TRUSTS,1,FIDUCIARY RELATIONSHIP TRUST
081183,,090823,GOVERNMENT OFFICERS AND PUBLIC OFFICIALS,0,1,090834=GOVERNMENT OFFICIALS AND PUBLIC OFFICERS,1,GOVERNMENT OFFICER OFFICIAL PUBLIC
081183,,090871,GUARDIAN AND WARD,0,26,091001=GUARDIANS AND WARDS,1,GUARDIAN WARD
081183,,091075,GUARDIANSHIP AND WARD,0,3,091121=GUARDIANSHIP AND WARDS,1,GUARDIANSHIP WARD
081183,,094625,MINORS AND INFANTS,0,3,091337=INFANTS AND MINORS,1,INFANT MINOR
081183,,091501,LEGAL CAPACITY AND DISQUALIFICATIONS,0,15,091495=LEGAL CAPACITY AND DISQUALIFICATION,1,CAPACITY DISQUALIFICATION LEGAL
081183,,091590,LEGAL PERSONHOOD AND STATUS,0,8,095357=PERSONHOOD AND LEGAL STATUS;096633=STATUS AND LEGAL PERSONHOOD,2,LEGAL PERSONHOOD STATU
081183,,091621,LEGAL PERSONS AND ENTITIES,0,10,095551=PERSONS AND LEGAL ENTITIES,1,ENTITIE LEGAL PERSON
081183,,095564,PERSONS AND LEGAL STATUS,0,36,091648=LEGAL PERSONS AND STATUS,1,LEGAL PERSON STATU
